{
  "$id": "holoagent0.trace-tool-policy.v1",
  "schema_version": "holoagent0.trace-tool-policy.v1",
  "digest_algorithm": "sha256",
  "rows": [
    {
      "tool": "strace",
      "version": "6.6",
      "platform": "linux-x86_64",
      "syscall_abi": "linux-x86_64",
      "source": {
        "url": "https://strace.io/files/6.6/strace-6.6.tar.xz",
        "size": 2420364,
        "sha256": "421b4186c06b705163e64dc85f271ebdcf67660af8667283147d5e859fc8a96c"
      },
      "build": {
        "recipe_path": "scripts/holoagent0_setup/provision_strace_6_6.sh",
        "recipe_sha256": null,
        "container_image_digest": null,
        "digest_algorithm": "sha256",
        "review_state": "PENDING_REPRODUCIBLE_BUILD"
      },
      "runtime": {
        "elf_path": "scripts/holoagent0_setup/trace/install/bin/strace",
        "elf_size": null,
        "elf_sha256": null,
        "version_output_sha256": null,
        "digest_algorithm": "sha256",
        "review_state": "PENDING_REPRODUCIBLE_BUILD"
      },
      "parser": {
        "path": "scripts/holoagent0_setup/holoagent0_setup/trace_normalizer.py",
        "sha256": "a34851683c13066d79f3ab83bb34ecb36114c08588e78b319e0e8641af30c992",
        "digest_algorithm": "sha256",
        "review_state": "REVIEWED"
      },
      "argv": {
        "options": [
          "--kill-on-exit",
          "-f",
          "-yy",
          "-ttt",
          "-T",
          "--no-abbrev",
          "--string-limit=1048576",
          "--quiet=none",
          "--trace=all"
        ],
        "raw_syscalls": [
          "read",
          "readv",
          "pread64",
          "preadv",
          "preadv2",
          "write",
          "writev",
          "pwrite64",
          "pwritev",
          "pwritev2",
          "sendfile",
          "splice",
          "vmsplice",
          "tee",
          "copy_file_range"
        ],
        "decoded_address_syscalls": [
          "sendto",
          "recvfrom",
          "sendmsg",
          "recvmsg",
          "sendmmsg",
          "recvmmsg"
        ],
        "environment": {
          "LC_ALL": "C",
          "TZ": "UTC"
        },
        "canonical_sha256": "c0f9ef1f4680ab2d8b660b4c38ff666c01ae5da5c9391efba4b9a89fd423c9cc",
        "digest_algorithm": "sha256",
        "review_state": "REVIEWED"
      },
      "fixtures": {
        "manifest_path": "scripts/holoagent0_setup/fixtures/strace/manifest-v1.json",
        "manifest_sha256": "016c0437c7ec04b70fdfbf581f835d9d0b41b1c8efcf8e1a37218167fd278f8b",
        "digest_algorithm": "sha256",
        "review_state": "REVIEWED"
      }
    }
  ],
  "additionalProperties": false
}
